{
  "schema_version": "0.1.0",
  "event_id": "00000000-0000-4000-8000-000000000010",
  "event_type": "message.edited",
  "account_id": "00000000-0000-4000-8000-000000000001",
  "connector": "replay",
  "session_id": "synthetic:session-1",
  "conversation_id": "00000000-0000-4000-8000-000000000002",
  "provider_message_id": "synthetic:message-1",
  "occurred_at": "2026-10-01T02:00:00Z",
  "received_at": "2026-10-01T02:00:01Z",
  "direction": "incoming",
  "source": "replay",
  "message_revision": 2,
  "payload": {
    "message_id": "00000000-0000-4000-8000-000000000004",
    "text": "还是保留原来的星期三，地址之后再发"
  }
}
