{
  "schema_version": "0.1.0",
  "event_id": "00000000-0000-4000-8000-000000000012",
  "event_type": "session.status",
  "account_id": "00000000-0000-4000-8000-000000000001",
  "connector": "replay",
  "session_id": "synthetic:session-1",
  "conversation_id": null,
  "provider_message_id": null,
  "occurred_at": "2026-10-01T02:00:00Z",
  "received_at": "2026-10-01T02:00:01Z",
  "direction": null,
  "source": "replay",
  "message_revision": null,
  "payload": {
    "status": "disconnected"
  }
}
